,created_utc,title,text,author,score,upvote_ratio,num_comments,url
0,1673829179.0,"Looking for books, videos, or other resources on specific or general topics? Ask here!",,mobotsar,93,0.99,113,https://www.reddit.com/r/computerscience/comments/10d016l/looking_for_books_videos_or_other_resources_on/
1,1686430573.0,/r/ComputerScience will be going dark starting June 12th in protest against Reddit's API changes which will kill 3rd party apps & tools,"## Update (June 16th, 2023):

This subreddit remains closed to new submissions and comments as part of the ongoing protest over Reddit policy changes. However, we've chosen to switch the subreddit to read-only, so that existing user contributions will not be censored.

# What's going on?

A recent Reddit policy change threatens to kill many beloved third-party mobile apps, making a great many quality-of-life features not seen in the official mobile app **permanently inaccessible** to users.

On May 31, 2023, Reddit announced they were raising the price to make calls to their API from being free to a level that will kill every third party app on Reddit, from Apollo to Reddit is Fun to Narwhal to BaconReader to Sync.

Even if you're not a mobile user and don't use any of those apps, this is a step toward killing other ways of customizing Reddit, such as Reddit Enhancement Suite or the use of the old.reddit.com desktop interface.

This isn't only a problem on the user level: many subreddit moderators depend on tools only available outside the official app to keep their communities on-topic and spam-free.

# What's the plan?

On June 12th, [many subreddits](https://reddit.com/r/ModCoord/comments/1401qw5/incomplete_and_growing_list_of_participating/) will be going dark to protest this policy. Some will return after 48 hours: others will go away *permanently* unless the issue is adequately addressed, since many moderators aren't able to put in the work they do with the poor tools available through the official app. This isn't something any of us do lightly: we do what we do because *we love Reddit*, and we truly believe this change will make it impossible to keep doing what we love.

The two-day blackout isn't the *goal*, and it isn't the end. Should things reach the 14th with no sign of Reddit choosing to fix what they've broken, we'll use the community and buzz we've built between then and now as a tool for further action.

What can *you* do?

1. **Complain.** Message the mods of r/reddit.com, who are the admins of the site: message /u/reddit: submit a [support request](https://support.reddithelp.com/hc/en-us/requests/new): comment in relevant threads on r/reddit, such as [this one](https://www.reddit.com/r/reddit/comments/12qwagm/an_update_regarding_reddits_api/), leave a negative review on their official iOS or Android app- and sign your username in support to this post.

1. **Spread the word.** Rabble-rouse on related subreddits. Meme it up, make it spicy. Bitch about it to your cat. Suggest anyone you know who moderates a subreddit join us at our sister sub at r/ModCoord - but please don't pester mods you don't know by simply spamming their modmail.

1. **Boycott and spread the word...to Reddit's competition!** Stay off Reddit entirely on June 12th through the 13th- instead, take to your favorite non-Reddit platform of choice and make some noise in support!

1. **Don't be a jerk.** As upsetting this may be, threats, profanity and vandalism will be worse than useless in getting people on our side. Please make every effort to be as restrained, polite, reasonable and law-abiding as possible.",nuclear_splines,290,0.97,21,https://www.reddit.com/r/computerscience/comments/146av03/rcomputerscience_will_be_going_dark_starting_june/
2,1686512465.0,How computers measure time,"Can someone explain this to me? I've been told that there is a chip that has a material that vibrates at a certain frequency when a certain current is passed through it, and when you pass a premeasured current, you just gotta measure the amount of oscillations to ""count"" time. But that's an inaccurate method, I've been told there's other methods used that are more precise, but no one is able to explain to me how those works. Please if you know this help.",RunDiscombobulated67,86,0.98,27,https://www.reddit.com/r/computerscience/comments/1473660/how_computers_measure_time/
3,1686513814.0,Question About Registers,"Hello everyone. There is a misunderstanding I have somewhere that I would like to clear up. 

I know that CPU registers are very fast and small and we can work with registers by writing assembly.

Here is where my misunderstanding/what I don't get lies: when I was taking my Architecture course, we had assignments where we had to program simple programs in assembly, like, say, a simple sort or something. 

If a program is running on the machine already, say I have a chat client running in the background on the machine, are the registers not in use running that program? How is it that I can write a sorting program in assembly moving values around to registers if the registers are already working with other data? Is there somehow no overlap?

What am I missing here?

If I want to MOV some value into some register like eax or something writing a program in assembly, how is there no other information there already such that I am overwriting or affecting other programs that are running?",mellowhorses,62,0.97,24,https://www.reddit.com/r/computerscience/comments/1473r8s/question_about_registers/
4,1686507294.0,Learning a new skill,"Hey guys,

Wanted to ask what a good computer language would be to learn for first timers. I had one c++ course in college that went over some of the basics of writing code and I liked solving problems in that way. I was hoping to develope a new skill for fun and maybe make a career change in the future.",Haunting_Document142,30,0.9,38,https://www.reddit.com/r/computerscience/comments/1470y63/learning_a_new_skill/
5,1686501559.0,"Recommendations of Hackathons, GameJams, Tech Conferences, and similar events?","I'm interested in many fields of CS so any event that you think is interesting, I will be looking it up. Though currently, I am interested the most in 3D graphics generation, data visualization, game dev, AR/VR and AI. I also have some experience in web dev, but not as much interest(still, will also be looking them up at least once).

Oh and an extra question: Which subreddit(s) would you recommend for being involved in and informed about these events?",trojaneo,32,0.89,8,https://www.reddit.com/r/computerscience/comments/146yixj/recommendations_of_hackathons_gamejams_tech/
6,1686406797.0,Any CS books which present their subject chronologically?,"I recently read calculus reordered and Real Analysis: A radical approach by David Bressoud and I really loved the idea of presenting the ideas of a subject as they developed through history, presenting the historical background of each part of the theory.

I am curious if there are any other books which are like that (books that present their material chronologically and try to explain the rationale behind each advancement in the theory, not cs history books)

I would also appreciate it if you could suggest a book in adjacent fields (math, etc)",ingsocks,78,0.94,13,https://www.reddit.com/r/computerscience/comments/1461hus/any_cs_books_which_present_their_subject/
7,1686409304.0,Best Practices using LaTeX.,"I have just finished my first seventy page thesis in LaTeX and would like to share my tips with you on your way and would also like to hear your tips for using TeX here below the post.

I started TeX locally on my computer with TeXShop. Unfortunately, my computer broke down while I was working. I could only restore parts of my work through my backups. Partly I wanted to work on other computers. For me personally, Overleaf ([https://www.overleaf.com/](https://www.overleaf.com/)) has turned out to be a very good companion as an editor in the browser. Overleaf also gave very good formatting tips during the work with regard to creating tables, missing parameters using BiBTeX and much more.

I used Zotero ([https://www.zotero.org/](https://www.zotero.org/)) as library management software. In particular, I quickly lost track of what was relevant to my work and where. With the browser add-on, I was able to save the sources relatively quickly and create my bibliography in BiBTeX format.

Make backups of your interim work at any time. Even if Overleaf saves your results online, you should create backups that contain the entire source code. The Pro version even offers Git integration.

To create notes for my work in the meantime I can strongly recommend the Todo package (to be imported with \\usepackage{todonotes}). Using the command \\todo{your note} you can then mark corresponding paragraphs at the right place.

Since LaTeX sometimes places graphics elsewhere, I can also recommend the package placins. With its help you can limit the placement to certain sections. The package can be imported using (\\usepackage\[section\]{placeins}) with the parameter section for section-limiting.

My thesis also has programming code in the appendix. To format it code-wise I highly recommend the package listings (to be imported using \\usepackage{listings}) 

These were my biggest helpers, I hope I can be of some help to one or the other of you. If you are also currently working on a TeX project. Otherwise, I am very curious about your tips.  


Peace out.",Sorry_Scale_1064,32,0.88,7,https://www.reddit.com/r/computerscience/comments/1462gue/best_practices_using_latex/
8,1686430666.0,Pumping lemma Question,"I have 2 languages the first one is regular and the second one is non-regular based on what our teacher mentioned. The languages are:

 1. {w∈Σ∗|w has an equal number of occurrences of ""ab"" and ""ba"" as substrings } 

2.  {w∈Σ∗|w has an equal number of occurrences of ""as"" and ""bs"" as substrings } 

&#x200B;

By using pumping lemma I can prove that there will be an imbalance of substring as n in y\^n increases which proves that both languages are non-regular. Can someone explain to me how my prof is correct?",Melodic-Scheme8794,9,0.92,7,https://www.reddit.com/r/computerscience/comments/146awaj/pumping_lemma_question/
9,1686345949.0,I don't understand the Halting Problem,"The key to the solution, from what I've got so far, is imagining a machine that can detect whether or not another machine halts. We'll call that machine H, that takes as input a machine Q

Then, with some simple logic, we can make a machine that halts when H detects Q doesn't halt, and that doesn't halt when it detects Q halts. That'd be Hn

So, with this machine Hn, the paradox would emerge by doing Hn(Hn), since now, if it were to halt, it shouldn't halt, but if it doesn't halt, it should halt. Paradox.

But, one key thing I don't get: Doesn't the internal Hn also need an input? And wouldn't all of the subsequent machines need an input as well, until we reach a static program?

So instead of being Hn(Hn), shouldn't the paradox only arrive if you do Hn(Hn(Hn(...))) forever? and at that point the paradox isn't thanks to the algorithm, but rather because it's a [supertask](https://youtu.be/ffUnNaQTfZE).

&#x200B;

The same could be said if you build a machine that takes another machine (one that halts) as an input outputs 0 when the original outputs 1, and outputs 1 when the original outputs 0, let's call that one N

N(N) should also be a paradox, no? After all, if N outputs 0, it should output 1, but if it were to output 1, it should output 0!

If you don't provide an internal input for the machine you are using as input, of course you can't analyze how it's going to run.",androt14_,51,0.88,47,https://www.reddit.com/r/computerscience/comments/145hbhu/i_dont_understand_the_halting_problem/
10,1686317231.0,How to Use a Collaborative Approach to Problem-Solving,"Hello there!

This is an article I posted on the original Algorithmically Speaking blog, that also got published on [freeCodeCamp](https://www.freecodecamp.org/).

Here, I share my vision on some aspects of technical interviews for programming jobs based on my own experiences when interviewing for a position at Volvo Cars and later as an interviewer myself.

Hope you enjoy it!

Disclaimer: all the code examples are written in Python but I don't think you will need a deep understanding of the language to get the most out of this article.

Read it here: [How to Use a Collaborative Approach to Problem-Solving](https://albexl.substack.com/p/collaborative-problem-solving)

Let me know your thoughts in the comments.",albeXL,7,0.77,1,https://www.reddit.com/r/computerscience/comments/14559fs/how_to_use_a_collaborative_approach_to/
11,1686235623.0,Good papers for high school students?,"This summer I am hosting an internship for 5 high school students (recent graduates through rising juniors) who have taken up to Computer Science AP, and may have taken cybersecurity, participated in extracurricular events, and so on.

I'm already planning on introducing them to the material from MIT's ""The Missing Semester of Your Computer Science Education"".

I'm looking for suggestions on good 'toe dipping' computer science papers in order to expose them to the idea that ""this stuff is approachable if you work at it"" early, and I'm looking for recommendations.

I've been considering stuff from Knuth's books like ""Selected Papers on Fun and Games"". Any specific suggestions from this audience?",bokmann,58,0.91,12,https://www.reddit.com/r/computerscience/comments/144b92r/good_papers_for_high_school_students/
12,1686252125.0,Practical computation with non-Vonn Neumann machines?,"Right now we do nearly 100% of our computation with Vonn Neumann machines. Occasionally we use them to emulate other forms of computation like neural networks.

I'm really interested in unconventional forms of computation. It looks like there's an infinite zoo of computational complexity out there - broad categories like cellular automata, neural networks, register machines, etc with endless variations within. 

But the tricky part is doing *practical* computation. Most of these systems are highly chaotic and impossible to program by hand. Neural networks are widely ""programmed"" through optimization, and this can be [extended somewhat](https://distill.pub/2020/selforg/mnist/) to cellular automata. 

Are there any examples of techniques to program other nonstandard computational systems? Bonus points if they're physical hardware instead of emulations.",currentscurrents,3,0.67,10,https://www.reddit.com/r/computerscience/comments/144ie3u/practical_computation_with_nonvonn_neumann/
13,1686202238.0,Theoretical Computational Model Stronger than turing machine,"Suppose two things: Time is infinite in the future, we can make a time machine.
Now imagine a machine that takes any question as input and runs on it just like a turing machine. If the turing machine halts in any point in the future it has the ability to go back in time to a exactly a second after you pushed the calculate button.
If you see a machine that came back in time after a second then the program halts. If you don't see a machine then it doesn't halt.

What do you think?",roughman99,26,0.83,13,https://www.reddit.com/r/computerscience/comments/1440dq1/theoretical_computational_model_stronger_than/
14,1686220059.0,Developer communities London UK,"Hello!

TLDR:
Does anyone in this community have any recommendations for groups or communities that meet in-person in london to work on projects together, learn together and network?

Background:
I’ve recently made the decision to try to pivot my career from a somewhat related role towards becoming a software dev. I’m doing a lot of personal learning to plug any knowledge/ coding gaps and I’m creating a portfolio of projects for interviews etc. However, one thing I feel I’m missing is the opportunity to work with other like minded individuals, learn together, network, meet potential employers, understand what it is that I don’t know etc. - and so I’m looking to find a community that meets in person fairly regularly and is set up to help with the above. 

Thanks in advance for any recommendations!",TheWopper,5,0.86,1,https://www.reddit.com/r/computerscience/comments/1445hf0/developer_communities_london_uk/
15,1686229451.0,"Judy Array, are they still a viable choice?","So I've been reading the [memcached](https://github.com/memcached/memcached/tree/32f382b605b4565bddfae5c9d082af3bfd30cf02) initial commit and notice their in memory storage is a Judy array. I can't really find a lot of info on this data structure besides the developers blog posts from almost 20 years ago. Wikipedia says it's needlessly complicated? Seems like skiplists and other bsp trees have similar use cases as well.

Is there any reason why I haven't seen this data structure more in modern code? Maybe I'm just ignorant?

If anybody is an old school open source dev I'd love to know what the Judy array was succeeded by.",sleazyrom,2,0.75,3,https://www.reddit.com/r/computerscience/comments/1448r06/judy_array_are_they_still_a_viable_choice/
16,1686169341.0,Ar/Vr development,"Hey! I was trying to get into Ar/Vr Development (Software). Could someone share some resources as to how can I get into this field. Tutorials, tips anything works",kratosnaamhaimera,9,0.76,9,https://www.reddit.com/r/computerscience/comments/143nu6y/arvr_development/
17,1686140699.0,What's the difference between Model Formulation and methodology in a computer science paper,"Struggling to find the difference, feels like methodology isn't really applicable to the field of CS. Am I wrong?",Jobdriaan,21,0.84,8,https://www.reddit.com/r/computerscience/comments/143bthq/whats_the_difference_between_model_formulation/
18,1686179746.0,"If we describe the size of combinatorics problem as 10^N, where is the solvability boundary in the case of CPU / GPU / Quantum Computing? (say, we have 1month)","In 2015, I saw Google's quantum computing is 100M times faster than previous GPU super computer. Maybe it is hard to say ""solvability boundary"" without defining the problem solving period clearly.",Dry-Beyond-1144,0,0.4,2,https://www.reddit.com/r/computerscience/comments/143sb9j/if_we_describe_the_size_of_combinatorics_problem/
19,1686144486.0,What is the best reference or dictionary sites with definitions in computer science,What is the best reference or dictionary sites with definitions in computer science like wikipedia or FOLDOC,Defiant_Security_971,4,0.75,5,https://www.reddit.com/r/computerscience/comments/143dbgi/what_is_the_best_reference_or_dictionary_sites/
20,1686062822.0,"Does anyone want/need my copy of ""Discrete Structures, Logic, and Computability"" by James L Hein?","Hello, former CS student here who is going through a decluttering process. 

Are you interested in this book? Maybe you're a professor who uses it and can give it away to a student in need. Maybe you're a student who needs it. 

Whoever you are, please take this book off my hands! All I ask is that you please cover the shipping costs. If you're interested, DM me your zipcode and I can let you know the cost. 

:)",ejtnjin,109,0.97,11,https://www.reddit.com/gallery/142idt9
21,1686137601.0,Data Retrain in SAS Viya,"Hi, everyone. i am new to this area and have a question over data retraining.

 When I am trying to use SAS Viya to manage new models (such as credit scoring), I am confused about what are the ways to select retraining datasets. For example, when evaluating the performances on the tested dataset (Q1,Q2,Q3,Q4,Q5) by looking at the ROC graph Q2 and Q5 are doing the best, and there are certain variables showing great differences across the quarters which requires retraining our model on other data. I wonder how do we choose the data we should use to retrain then? What are the standards or ways to select the data we use? It will be great If anyone can help me with this question, thank you!    ( this is the link for the tutorial I am looking at, [https://www.youtube.com/watch?v=IGW77r-KQDc](https://www.youtube.com/watch?v=IGW77r-KQDc) , in their example, we will using the most recent data Q5’s data to retrain as the model is degrading over time, but if the the degrading is not following a timely order? )",aebsnyt,0,0.5,1,https://www.reddit.com/r/computerscience/comments/143apzd/data_retrain_in_sas_viya/
22,1686146010.0,What kind of text-file format is the best for specifying trees.,"Hello.

I'm playing with the thought of writing a program  for rendering trees.

In the first instances, they are just rendered in the command line window as a regular tree.

I want to just make a text file to be parsed as a tree, with the bare minimum of fuzz, so it is as easy as possible to define a tree, but with as little amount of ambiguity as possible. And it should be easy to edit the definition, add delete
nodes and so on.

I have thought of using markdown headings for speciffying levels, but thinks that even that is a little too much.

As I see it I have two alternatives that are viable:

* tab indentation 

    root
        level1
             level 2
        level1
             level 2
                 And so on

* markdown headers, much like the first one.

I think, having to make the user write it as a tree is implemented in an array is too much.

I wonder if I am overlooking some other options for defining a tree by a text file, which is just as easy. (I have considered numbering, but thinks renumbering will be too big a chore.)

**Edit**

I want a file format as simple as possible for being able to parse a text file as an inorder binary tree, with as little markup as humanly possible, and yet leave as little room as possible for ambiguities.

The motivation behind this, is to lower the threshold for drawing a graph down to nothing. The end goal, is to output pic scripts you can edit further, and then have pic render the diagrams as svg or whatever format available.
 
So, thank you for any suggestions!",McUsrII,0,0.38,11,https://www.reddit.com/r/computerscience/comments/143dwyv/what_kind_of_textfile_format_is_the_best_for/
23,1686155021.0,Can Blockchain replace Cloud,"Hey,
I am a student of CS and have really been pondering about the newer techs emerging, I have been very interested in cloud and am also pursuing Architect cert from Azure, but all the hype around has been a concern that if blockchain will replace cloud. I am new to all this as I told I just am a student rn, I am eager to know if this scenario could ever happen bcoz rn I have time to switch over to blockchain(I like CS as whole not just cloud). I am really looking for some guidance. So, just wanted to know yall folks opinions.
Thank You!!",MridulSharma11,0,0.15,27,https://www.reddit.com/r/computerscience/comments/143hqad/can_blockchain_replace_cloud/
24,1686036579.0,how do computers or any digital device actually work?,"like I understand, logical gates are setup to perform corresponding opetations and i/p and o/p is given as voltage (high/low). so how does, these logical operations make a word doc, web browsing work?",Substantial_Novel_59,11,0.68,14,https://www.reddit.com/r/computerscience/comments/1427lfh/how_do_computers_or_any_digital_device_actually/
25,1686089966.0,What does the market for file compression look like these days ?,"I don’t know if this is the right sub, but I was wondering if the market for compression is booming right now. I’m phrasing it poorly but how much do you think a new and improved file compression system might be worth ?",jodywa05,0,0.38,8,https://www.reddit.com/r/computerscience/comments/142v6d6/what_does_the_market_for_file_compression_look/
26,1686016745.0,Introduction to Quantum Computing with IBM Quantum,"I found this program today. Quantum computing can potentially change our world, applications include revolutionizing cybersecurity. This appears to be a virtual program and you can apply  for scholarships. Otherwise it could cost up to $1.2K for both semesters. 

I signed up, looking forward to not only learning a useful skill but network with potetentially future millionaires. 

https://www.qubitbyqubit.org/course-info",LittleYogurtcloset68,16,0.86,4,https://www.reddit.com/r/computerscience/comments/141zwfu/introduction_to_quantum_computing_with_ibm_quantum/
27,1686008843.0,What book should I read first on computer science?,I need to find something basic and understanding.,RelativeMediocre3120,7,0.71,7,https://www.reddit.com/r/computerscience/comments/141whhs/what_book_should_i_read_first_on_computer_science/
28,1686074969.0,Artificial Image Research - be part of something big!,"Hi r/computerscience,

I'm writing a research paper on  creating artificial images and I need your help!

&#x200B;

I'm researching the effectiveness of **Human Eye Perceptual Evaluation (HYPE)** which is basically using human vision as a metric of evaluating how good a piece of AI generated art really is.

&#x200B;

**In particular, I need the help of redditors in answering this form to bump up the sample size before I can get permission to conduct official research:** [https://forms.office.com/e/YhBxsA6Lej](https://forms.office.com/e/YhBxsA6Lej)

&#x200B;

There are multiple questions but they are quick fire multiple choice (i.e. real or fake) so thank you for your time!",FeZzUs,0,0.17,0,https://www.reddit.com/r/computerscience/comments/142oels/artificial_image_research_be_part_of_something_big/
29,1685968481.0,"Cycle detection in graphs does not have to be hard: A lesser known, simple way with Kahn’s algorithm",,broken_broken_,24,0.93,1,https://gaultier.github.io/blog/kahns_algorithm.html
30,1685999035.0,Interview with Andrew Ng and Chelsea Finn: AI & Robotics,,Stanford_Online,6,0.87,0,/user/Stanford_Online/comments/141rknt/interview_with_andrew_ng_and_chelsea_finn_ai/
