,created_utc,title,text,author,score,upvote_ratio,num_comments,url
82,1684848250.0,Extracting Antimicrobial Activity Data from Scientific Articles,"I need advice on extracting relevant information from articles on the antimicrobial activities of herbs. I want to extract data such as plant species, tested microbial species, the methodology used, and corresponding antimicrobial activity values.

I have a database of 4152 plant species. For each plant species, I want to find a scientific article that reports its antimicrobial activity against tested microbial species. From each article, I need to extract:

Plant species name
Tested microbial species
Methodology for antimicrobial activity testing
Numeric values associated with antimicrobial activity (e.g., MIC values)
I'm seeking suggestions, advice, and potential solutions for computationally tackling this project using machine learning or NLP.

If you have any relevant resources, code snippets, or libraries that can assist in this data extraction task, please share them. Your help and suggestions are greatly appreciated.

Note: I'm open to collaborating with individuals or teams interested in working on this project. Feel free to reach out if you're interested in joining forces.

Thank you in advance for your assistance!",Apprehensive_View366,4,0.75,0,https://www.reddit.com/r/computerscience/comments/13pog5s/extracting_antimicrobial_activity_data_from/
83,1684705427.0,Filling up 32bit opcode chart,"Hi, I am designing a 16 bit computer with 32bit instruction word. I have all components setup, but now I need to connect them. The thing is, that it would be great to know how which depends on the opcode. I want an advice how to use the 32bits. How many bits should specify the operation? Is 6bits (64 operations) enough? Or should I have 8 bits? I have 16 registers. I want 3 operand opcode therefore 12 bits are reserved for this purpose, when doing operations on data. 20bits left, so if 6-8?bits specifies operation then 12 or 14 bits are unused for operations on data. I cold use 2 bits  (or more?)to specify the mode of operation (adding with carry... etc.). But then there is like a byte empty. Some operation's doesn't use all the bits that's fine but is there a something I could fit in there?",Squixell,21,0.9,6,https://www.reddit.com/r/computerscience/comments/13o7afe/filling_up_32bit_opcode_chart/
84,1684575711.0,"A visual introduction to the concepts of Degrees, Colorings, and Bipartite Graphs.","Hello there!

Today we will be diving into one of the most common ways of representing data and modeling problems (and solutions) in Computer Science. We will be talking about **Graphs**.

This is the second of a series of posts introducing graph theory in a very visual way.

It will consist of some basic definitions of graph theory that will lay the basis for us to be able to explore more complex topics in future posts. The idea is to present the definitions along with visual representations, to help in the process of learning new concepts.

Take a look at the previous posts of this series if you think you need some more background before diving into the content that will be exposed in this article:

1. [Algorithmically Speaking - #3: Nodes, Edges, and Connectivity](https://albexl.substack.com/p/introduction-to-graph-theory)

**This is a summary version of the weekly edition of the Algorithmically Speaking newsletter. You can read the full article here:**

[Algorithmically Speaking - #4: Neighbors, Degrees, and Colorings](https://albexl.substack.com/p/an-introduction-to-graphs-ii)

Let’s begin!

 \_\_\_\_\_\_\_\_\_\_\_\_\_\_\_\_\_\_\_\_\_\_\_\_\_\_\_\_\_\_\_\_\_\_\_\_\_\_\_\_\_\_\_\_\_\_\_\_\_\_\_\_\_\_\_\_\_\_\_\_\_\_\_\_\_\_\_\_\_\_\_\_\_\_\_\_\_\_\_\_\_\_\_\_\_\_\_\_\_\_\_\_\_\_\_\_\_\_\_\_

## Neighbors and Degrees

Two nodes are **neighbors** or **adjacent** if there is an edge between them. The **degree** of a node is the number of its neighbors.

In the following graph, we have highlighted a node (colored in green), its neighbors (colored in red), and the edges between them (colored in blue):

https://preview.redd.it/jvl23n8vey0b1.png?width=771&format=png&auto=webp&s=18708ac8986ca1fd7d6ef1ba33b192216fcb8725

 We can see that the green node has three incident edges and three neighbors, and therefore, it has a degree equal to 3.

In the next image, we can see the degree of every node:

https://preview.redd.it/0t39le8yey0b1.png?width=771&format=png&auto=webp&s=f16cea127a7992d600b19efa87996748e30c5d73

Something to notice is the fact that the sum of degrees in a graph is always 2m, where m is the number of edges. This happens because each edge increases the degree of exactly two nodes by one. So, the sum of the degrees is always even.

A graph is **regular** if the degree of every node is a constant d. A graph is **complete** if the degree of every node is n−1, where n is the number of nodes in the graph. That is, the graph contains all possible edges between the nodes. By definition, a complete graph is a regular graph.

Here’s an example of a regular graph that is not complete. Notice how the degree of every node is 2:

https://preview.redd.it/bwfrwpd4fy0b1.png?width=479&format=png&auto=webp&s=530ddf6f453e469d1c48e9b5cab34dcccc6acf18

And this is an example of a complete graph. Notice how the degree of every node is 3 and there are 4 nodes: 

https://preview.redd.it/ba443hp6fy0b1.png?width=479&format=png&auto=webp&s=613e6cfc34180beffb17c90f123bb955b08a7c00

When we are referring to directed graphs, we define the **indegree** of a node as the number of edges that end at the node, and the **outdegree** of a node as the number of edges that start at the node.

Here’s an example highlighting a node with an indegree equal to 2 and an outdegree equal to 1:

https://preview.redd.it/zsztfb9bfy0b1.png?width=771&format=png&auto=webp&s=f79bda1967ee721c48abb24d957b0a4214517aca

And these are the values of indegree/outdegree for every node. Notice how some nodes can have indegree or outdegree equal to 0:

https://preview.redd.it/gehnxdeefy0b1.png?width=780&format=png&auto=webp&s=862850d6cdae875c579179d484463b13dc0005d6

## Colorings

In a **coloring** of a graph, each node is assigned a color so that no adjacent nodes have the same color.

A graph is called **bipartite** if it is possible to find a coloring of its nodes using two colors. It can be proven that a graph is bipartite exactly when it does not contain a cycle with an odd number of edges.

For example, the following graph is bipartite:

https://preview.redd.it/u3ff564kiy0b1.png?width=771&format=png&auto=webp&s=f2fc3727103e4960f4f12348df9cdd73905c0ce7

 We can claim that it is bipartite because we can find a coloring of the graph using only two colors:

https://preview.redd.it/5q6tlbamiy0b1.png?width=771&format=png&auto=webp&s=a94bc6fb6e332cbf339c94e1718aab36831641f5

And here’s a more intuitive way to visualize bipartite graphs. The previous and the following graphs are the same: 

https://preview.redd.it/323j7qmoiy0b1.png?width=604&format=png&auto=webp&s=f5d2fda73372482f91636d8ed28b4511c72800c8

With this representation, it becomes visually more clear that the nodes can be split into two sets, and that every edge in the graph connects nodes from different sets.

Now, let’s take a look at the following graph:

https://preview.redd.it/zw1ejb3riy0b1.png?width=771&format=png&auto=webp&s=9b2327d0cc3a220489b0b45add7e217cf5cf5a08

No matter how hard you try, you won’t be able to find a coloring of this graph using only two colors. Remember earlier, when we said that cycles of odd length and bipartiteness are related?

Inspecting the graph closely, we can notice that it contains a cycle of length 3. It won’t be possible to color this cycle (or the entire graph) using only two colors:

https://preview.redd.it/32fw886tiy0b1.png?width=771&format=png&auto=webp&s=03f2155022d4c1eb696d067ab4abba305c15283a

In future posts, we will explore algorithms to determine if a graph is bipartite or not. Also, we will dig deeper into how the degrees of nodes play an important role in finding topological orderings in directed graphs.",albeXL,29,0.87,0,https://www.reddit.com/r/computerscience/comments/13mng69/a_visual_introduction_to_the_concepts_of_degrees/
85,1684544115.0,Looking for theoretical CS books to gift a high schooler,"My cousin who's in high school has his birthday coming up. He likes to geek over his machine-learning projects: Small stuff that you can tinker with in Python and get up and running. I want to give him a taste of what theoretical computer science looks like; i.e. stuff like complexity theory, learning theory, computational logic, and the like, that'll make him think about the deeper aspects of computer science. I am not sure if books for such an audience exists, especially given that he does not have a rigorous background in statistics or languages, and would really like recommendations from the community. Thanks in advance!",evil_indian_potato,31,0.87,26,https://www.reddit.com/r/computerscience/comments/13mdcv8/looking_for_theoretical_cs_books_to_gift_a_high/
86,1684503591.0,"Algorithmically Speaking - #4: Neighbors, Degrees, and Colorings","Hello there!

Today we will be diving into one of the most common ways of representing data and modeling problems (and solutions) in Computer Science. We will be talking about **Graphs**.

This will be the first of a series of posts introducing graph theory in a very visual way.

It will consist of some basic definitions of graph theory that will lay the basis for us to be able to explore more complex topics in future posts. The idea is to present the definitions along with visual representations, to help in the process of learning new concepts.

At the end of the post, you will find some algorithmic challenges so you can try and apply some of the topics that I will explain today. Feel free to skip to that part if you think you already have the necessary skills to solve them.

Have a nice read!

[Algorithmically Speaking - #4: Neighbors, Degrees, and Colorings](https://albexl.substack.com/p/an-introduction-to-graphs-ii)",albeXL,34,0.91,0,https://www.reddit.com/r/computerscience/comments/13lvrh2/algorithmically_speaking_4_neighbors_degrees_and/
87,1684518542.0,Book recommendations for route planning,I am interested in route planning for trucking and last mile delivery and would love to read up on it.,burg_to_314,5,0.86,0,https://www.reddit.com/r/computerscience/comments/13m2lts/book_recommendations_for_route_planning/
88,1684431890.0,Is ssh authentication an example of Zero Knowledge Proofs?,"When i use ssh authentication, I am not sending my private key to my authenticating entity, but the fact that i can use the private key to decrypt some information encrypted using the public key proves that i have the private key. This seems like a zero knowledge proof.",terimamimeri,28,0.91,9,https://www.reddit.com/r/computerscience/comments/13l5kn7/is_ssh_authentication_an_example_of_zero/
89,1684509706.0,Even Geoffrey Hinton quit his job. What should we learn and what should we do now?," Guys, we realized that ai is quite dangerous. I'm interested in software developement (but not ai). I have a lot of questions about these situations.

What and how much will we know about AI in the future? Should w learn to use AI or will the technologies that will prevent AI be valued? And what should the elderly, not the young, do and learn? How can we raise awareness about artificial intelligence? What are you doing about these issues?",Ced3j,0,0.35,11,https://www.reddit.com/r/computerscience/comments/13lylrz/even_geoffrey_hinton_quit_his_job_what_should_we/
90,1684434648.0,What are some cool Computer Science journals that you can read as social media?,"I’m trying to replace Social Media in my life with something better than it. I’m a subscriber for a few culture related journals, but nothing about CS. Any recommendations?",DogronDoWirdan,5,0.78,1,https://www.reddit.com/r/computerscience/comments/13l6v1u/what_are_some_cool_computer_science_journals_that/
91,1684431201.0,Data Structures - Doubt about a definition in Priority Queue,"I'm trying to understand the following question, from a test, about priority queue:

    What is the sorting method represented by a linear array 
    filled with keys s_1,..,s_n satisfying the following property: 
    s_i <= s_{1/2}, for i<=n? 
    a) Insertion
    b) Priority Queue
    c) Quicksort
    d) Shellsort
    e) Selection

Well, given that I know the correct answer and understand the basics about this abstract data structure, I have no idea how to justify that an implementation of it has this property described.  Can someone explain it to me or point to a reference about that?",linconcr,2,1.0,6,https://www.reddit.com/r/computerscience/comments/13l5ajz/data_structures_doubt_about_a_definition_in/
92,1684422546.0,Can all NP-complete problems be reduced to NP?,"

I know that by definition, all NP problems can be reduced to  NP-Complete problems. But does that also applies the other way around?

Can all NP-Complete be reduced to NP problems?

My understanding is that it cannot be done, since that would mean that both are equally complex, therefore NP=NP-Complete.

But the answer to this post seems to point into this direction: [Can an NP-Complete problem be reduced to an NP problem?](https://cs.stackexchange.com/questions/128873/can-an-np-complete-problem-be-reduced-to-an-np-problem)",Oatwarrior,0,0.5,25,https://www.reddit.com/r/computerscience/comments/13l1n1x/can_all_npcomplete_problems_be_reduced_to_np/
93,1684337736.0,Sending data from a device to another without DMA and without CPU,"A very basic and stupid question that I've been thinking about. I don't think it's possible, i just cannot think why its not possible. Like why can't I just have two USB sticks magically transfer data from one device to another.

Q: Can a device send data to another device without dma or cpu. i.e no memory is involved, no cpu is involved.",nudebaba,17,0.76,14,https://www.reddit.com/r/computerscience/comments/13k56wq/sending_data_from_a_device_to_another_without_dma/
94,1684346232.0,What does it take to create a log monitoring system?,"With the log monitoring seemingly always a paid service. What does it take to build one in-house. 

My understanding is that if the app logs are already formatted in JSON it's all about representing it as graphs on a web UI which might include the # hits based on unique ips, 4XX errors 5XX and 2XX responses. Am I missing any thing here?",duniyaa,2,0.63,2,https://www.reddit.com/r/computerscience/comments/13k93ob/what_does_it_take_to_create_a_log_monitoring/
95,1684255279.0,Programming without a stack trace: When abstractions become illusions,"This [insightful article](https://architectelevator.com/architecture/stacktrace-abstraction/) by [Gregor Hohpe](https://linkedin.com/in/ghohpe) covers:

* Evolution of programming abstractions.
* Challenges of cloud abstractions.
* Importance of tools like stack traces for debugging, especially in distributed systems.

Gregor emphasizes that effective cloud abstractions are crucial but tricky to get right. He points out that debugging at the abstraction level can be complex and underscores the value of good error messages and observability. 

The part about the ""unhappy path"" particularly resonated with me: 

>The unhappy path is where many abstractions struggle. Software that makes building small systems easy but struggles with real-world development scenarios like debugging or automated testing is an unwelcome version of “demoware” - it demos well, but doesn’t actually work in the real world. And there’s no unlock code. ... I propose the following test for vendors demoing higher-level development systems:  
>  
>1. Ask them to enter a typo into one of the fields where the developer is expected to enter some logic.  
>  
>2. Ask them to leave the room for two minutes while we change a few random elements of their demo configuration. Upon return, they would have to debug and figure out what was changed.  
>  
>Needless to say, no vendor ever picked the challenge.

# Why it interests me

I'm one of the creators of [Winglang](https://github.com/winglang/wing), an open-source programming language for the cloud that allows developers to work at a higher level of abstraction. 

We set a goal for ourselves to provide good debugging experience that will allow developers to debug cloud applications in the context of the logical structure of the apps.

After reading this article I think we can rephrase the goal as being able to easily pass Gregor's vendor test from above :)",shai-ber,43,0.93,0,https://www.reddit.com/r/computerscience/comments/13jaas7/programming_without_a_stack_trace_when/
96,1684255308.0,"What's the difference between clock - cycle , clock - pulse and clock edge ?",I find these terms confusing. Please help me understand.,,8,0.83,2,https://www.reddit.com/r/computerscience/comments/13jab8z/whats_the_difference_between_clock_cycle_clock/
97,1684147304.0,Curated list of all Financial Computer Science Competitions [Open for contribution],"Hey guys, I am currently checking all the good Computer Science contests with prize money. I thought you might be interested in my curated list!

Feel free to suggest edits!

I just created a Github repository to [**stay up to date**](https://github.com/go-east/machine-learning-competitions) |

Don't hesitate to contribute! I would like to make it a website one day :)

&#x200B;

||Pro|Con|
|:-|:-|:-|
|[**Worldquant**](https://www.worldquant.com/)|Potential for recruitment at WorldQuant Cash prizes Highly competitive competition|Difficult to differentiate yourself in the crowd! (well you need to win)|
|[**Datathon by Citadel**](https://www.citadel.com/careers/students/datathons/)|Access to real-world problems Potential for recruitment|Difficult to differentiate yourself from the crowd! (well you need to win)|
|**Challenge Data**|Diverse challenges Yearly award ceremony|No financial reward, competition is for the love of mathematics|
|[**ADIA Lab Competition**](https://crunchdao.com/live/adialab)|Opportunity to compete among the best in the field. Biggest Prize Pool!|Uncertain about potential recruitment|
|[**Kaggle**](https://kaggle.com)|Well...Most well-known competition Diverse challenges Variety of topics Multiple competitions|Difficult to differentiate yourself Not focused on finance|
|[**CrunchDAO**](https://crunchdao.com)|Opportunity to compete among the best in the field Opportunity to earn passive income. Support from DAO community. Receive certification from top financial institutions. Opportunity to earn Passive Income|Community access is exclusive.|

&#x200B;",Cruncher_ben,39,0.87,13,https://www.reddit.com/r/computerscience/comments/13i4kka/curated_list_of_all_financial_computer_science/
98,1684167892.0,Operating system (ish) question,Would it be easier to make a program that mimics an operating system without actually making it an operating system?,ZookeepergameFit4103,0,0.27,11,https://www.reddit.com/r/computerscience/comments/13icswj/operating_system_ish_question/
99,1683968368.0,A Visual Introduction to the basic concepts of Graph Theory.,"Hello there!

Today we will be diving into one of the most common ways of representing data and modeling problems (and solutions) in Computer Science. We will be talking about **Graphs**.

This will be the first of a series of posts introducing graph theory in a very visual way.

It will consist of some basic definitions of graph theory that will lay the basis for us to be able to explore more complex topics in future posts. The idea is to present the definitions along with visual representations, to help in the process of learning new concepts.

**This is a summary version of the weekly edition of the Algorithmically Speaking newsletter. You can read the full article here:**

[Algorithmically Speaking - #3: Nodes, Edges, and Connectivity](https://albexl.substack.com/p/introduction-to-graph-theory)

Let’s begin!

\_\_\_\_\_\_\_\_\_\_\_\_\_\_\_\_\_\_\_\_\_\_\_\_\_\_\_\_\_\_\_\_\_\_\_\_\_\_\_\_\_\_\_\_\_\_\_\_\_\_\_\_\_\_\_\_\_\_\_\_\_\_\_\_\_\_\_\_\_\_\_\_\_\_\_\_\_\_\_\_\_\_\_\_\_\_\_\_\_\_\_\_\_\_\_\_\_\_\_\_\_\_\_\_\_

## Nodes, Edges, and Paths

A **graph** consists of **nodes** and **edges**. We could see the nodes as the fundamental entities of graphs, and edges represent the relationships between nodes.

One good thing about graphs is that, even if they represent an abstract mathematical definition, we can visually display them using the most simple drawings of circles and lines.

Here’s a hand-drawn image of a graph with 5 nodes and 7 edges that we will we use to help us understand some basic definitions:

https://preview.redd.it/0a1y8llz8kza1.png?width=771&format=png&auto=webp&s=e13eb20bb4d163185d0b754ce8a619c2c6abd44a

A **path** leads from node **a** to node **b** through the edges of the graph. The length of a path is the number of edges in it.

The highlighted (red) path between the two green nodes in the following image is of length 3:

https://preview.redd.it/a36yrzy09kza1.png?width=771&format=png&auto=webp&s=dc22c26073857a8d5a773e081e7929af429c67f3

>***Note****: The highlighted path is just one of the possible paths between the two green nodes. Try to identify every possible path between them.*

A path is a **cycle** if the first and last node is the same. On the other hand, a path is called **simple** if each node appears at most once in the path.

The highlighted path in the previous image corresponds to a simple path, while the one in the following image is considered a cycle:

https://preview.redd.it/hpnn0bz39kza1.png?width=771&format=png&auto=webp&s=c981d45b507ec9cddf18e3dbd1f445da167b9ff3

## Connectivity

A graph is **connected** if there is a path between any two nodes. For example, our initial graph is connected:

https://preview.redd.it/aldp6s2o9kza1.png?width=771&format=png&auto=webp&s=315fd6168db76955c5f7469e63246228dd829857

>***Try it yourself****: take any pair of nodes in the previous graph and check that, indeed, there is a path between them.*

On the other hand, the following graph is **not connected** because there is no path between the highlighted nodes:

https://preview.redd.it/u1wp2s2lakza1.png?width=1012&format=png&auto=webp&s=7684d57bebc41f14bfaf7b48cb67bb0284610563

In fact, there is no path between any node located in the right-bottom corner and any node located in the left-top corner.

The sets of connected nodes in a graph are called **connected components**. Here are the connected components (nodes with the same color) of the previous graph:

https://preview.redd.it/h049y5nnakza1.png?width=1296&format=png&auto=webp&s=2e0495b2e55586068ba40a158dcd11fcbf9ccbd8

We can clearly see that this graph has two connected components.

A **tree** is a connected graph that consists of **n** nodes and **n−1** edges. There is a unique path between any two nodes of a tree. You can also think of a tree as a connected graph that doesn’t contain any cycles.

The following graph is a tree:

https://preview.redd.it/b29o042rakza1.png?width=771&format=png&auto=webp&s=2158bdac8f4013ed1f327e7a8129dc111dae5171

>***Try it yourself****: take any pair of nodes in the previous graph and check that, indeed, there is a* ***unique*** *path between them.*

## Direction and Weights

A graph is **directed** if the edges can be traversed in one direction only. For example, the following graph is directed:

https://preview.redd.it/qduyg4btakza1.png?width=771&format=png&auto=webp&s=8bbd5eecbd306c9b5e207feab5fea676ed1bfc9c

Notice how in the following image there is a path (more than one actually) between the green node and the blue node, but the opposite is not true. You cannot find any path starting in the blue node and ending in the green one:

https://preview.redd.it/x04bpvlkckza1.png?width=771&format=png&auto=webp&s=a5a8f97b1f4d4e3610ce17aa6433008f7eeb7dd6

As we can see, the fact the graph is directed affects the concept of connectivity, which is called **strong connectivity** when we are referring to directed graphs. We will learn more about this in future posts.

In a **weighted** graph, each edge is assigned a **weight**. The weights are often interpreted as edge lengths.

The following graph is weighted:

https://preview.redd.it/convruznckza1.png?width=771&format=png&auto=webp&s=9b29d6107bf86ae4ecbf305c3602d1f01e609ece

The length of a path in a weighted graph is the **sum** of the edge weights on the path. For example, in the following graph, the length of the highlighted path between the green nodes is 13 (8 + 5):

https://preview.redd.it/orcc39orckza1.png?width=771&format=png&auto=webp&s=18e069b59160b40f18f94ae7037b4f5d44cb1779

In future posts, we will explore algorithms related to connectivity, we will dig deeper into the importance of weights, and will learn some definitions that only make sense when we are talking about directed graphs.",albeXL,109,0.97,5,https://www.reddit.com/r/computerscience/comments/13gc8jm/a_visual_introduction_to_the_basic_concepts_of/
