,created_utc,title,text,author,score,upvote_ratio,num_comments,url
31,1685967533.0,Edit Distance and Longest Common Subsequence," Could you explain why the longest common subsequence (LCS) problem is a special case of the edit distance problem? I read that in the solution to LCS I should avoid substitutions. I don't understand why that is the case.  
Thank You.",chirathpansilu,5,0.86,2,https://www.reddit.com/r/computerscience/comments/141cqkk/edit_distance_and_longest_common_subsequence/
32,1685984429.0,Calculus,I am struggling with calculus and was wondering how much will we be using calculus in Computer Science.,BennieMiller,1,0.54,14,https://www.reddit.com/r/computerscience/comments/141ky9c/calculus/
33,1685907575.0,Best computer science and related youtubers,"Hello! How's everyone?

I would like to ask, in your opinion, which are the best computer science related youtubers and why you like their videos.

Thanks for sharing!",,87,0.97,38,https://www.reddit.com/r/computerscience/comments/140nu1w/best_computer_science_and_related_youtubers/
34,1685983617.0,The unique promise of ‘biological computers’ made from living things,,veterinarysite,1,0.57,0,https://www.scihb.com/2023/06/the-unique-promise-of-biological.html
35,1685899850.0,Full SQL Manual on GitHub,"I Created a **full manual for SQL** in GitHub [FSM](https://github.com/AmmarAbdelhalem/FSM) as repo, And the topics is:

* Introduction to databases and SQL
* Data Types and Data Definition
* Creating and modifying database objects
* Data manipulation
* Aggregate functions
* Subqueries and joins
* Transactions and concurrency
* Stored procedures and triggers
* Advanced topics

**If you find these useful support me with star and share it with your friends**",Ammar-Abdelhalem,47,0.89,3,https://www.reddit.com/r/computerscience/comments/140jzgf/full_sql_manual_on_github/
36,1685806624.0,Pneumatic computer uses pressure instead of electricity,,veterinarysite,49,0.96,2,https://www.scihb.com/2023/06/pneumatic-computer-uses-pressure.html
37,1685868002.0,"How, if at all, do the digits in hex color codes interact with various qualities of their corresponding color?","Please redirect me if this is the wrong place to ask this. If I have a hex color code but want to modify the hue/value/chroma, is there a way I can predictably do this by modifying the hex code directly? I have a CS degree but this was never covered beyond ""each color has a hex code,"" at least not that I can recall.",animaldander,3,0.71,12,https://www.reddit.com/r/computerscience/comments/1406hvs/how_if_at_all_do_the_digits_in_hex_color_codes/
38,1685761606.0,"You've been warned. Stop sharing your life and personal information, emails, documents, with Chat GPT and chat GPT plugins. Wait for encryption.",,the_anonymizer,134,0.81,24,https://theconversation.com/chatgpt-is-a-data-privacy-nightmare-if-youve-ever-posted-online-you-ought-to-be-concerned-199283
39,1685869866.0,How to create your own and decryption in CBC mode?,,HeadClicker52,0,0.33,3,https://www.reddit.com/r/computerscience/comments/140769h/how_to_create_your_own_and_decryption_in_cbc_mode/
40,1685808524.0,Millions of PC Motherboards Were Sold With a Firmware Backdoor,,Akkeri,11,0.87,0,https://www.wired.com/story/gigabyte-motherboard-firmware-backdoor/
41,1685782863.0,Exploring how to model board games as graph problems.,"**This is a summary version of the weekly edition of the Algorithmically Speaking newsletter. Subscribe to the** [newsletter](https://albexl.substack.com/) **and get these articles straight into your inbox.**

\-----------------------------------------------------------------------------------------------------------------------------------------------------

Hello there!

After three weeks of learning the basics of graphs, I think it is time to show you examples of how we can translate real-life problems to the graph theory domain

This will be the last of a series of posts introducing the basic concepts of graph theory before we dive into topics such as traversals, and finding cycles, among others.

Here’s a summary of what we have covered in the previous editions:

1. Introduction to the concepts of [nodes, edges, and connectivity](https://albexl.substack.com/p/introduction-to-graph-theory).
2. Defining what are [neighbors, degrees, and colorings](https://albexl.substack.com/p/an-introduction-to-graphs-ii) in graphs.
3. How to [represent graphs](https://albexl.substack.com/p/graphs-representation) in a computer program.

Today, we will learn about practical examples of how to use graphs in real life. For that, we are going to see examples of “games” that are played on boards. They might seem unrelated to graphs, but the truth is that they are more closely related than you might think.

At the end of the post, you will find some algorithmic challenges so you can try and apply some of the topics that I will explain today. Feel free to skip to that part if you think you already have the necessary skills to solve them.

Let’s begin!

## An Initial Problem

Let’s dive in straight to the matter. Take a look at the following problem and think about how you would approach it:

https://preview.redd.it/krf1rmu0nr3b1.png?width=1304&format=png&auto=webp&s=c6890cc02f7ecafa3327f392163608c2660c39d1

By simple inspection, we can notice that there are three “sets“ of floor tiles that can be identified as “rooms“. These are all the rooms highlighted and numbered: 

https://preview.redd.it/skr7qk73nr3b1.png?width=649&format=png&auto=webp&s=974ae5fafd8e618a05834c62ccb1dc555baf635d

Intuitively, we identify these “connected“ regions and we sort them out as “rooms” because it just makes sense in our heads.

But what if this was the input to a program? How could we design an algorithm that a computer will execute to find the number of “rooms” in any map of a house that uses this representation?

Well, unfortunately, before thinking about designing algorithms we have to think about modeling this problem in terms that a computer can understand. And one possibility, as you might have suspected already, is doing so by using graphs.

## Representing Boards as Graphs

Let’s talk about a classical way of representing boards using graphs. Take a look at the following problem and try to think of a solution.

This time go a bit further and try to think of a general solution, instead of just solving this particular instance. It’s ok if you can’t, I will show you how to do it soon.

https://preview.redd.it/f04jvvg6nr3b1.png?width=1304&format=png&auto=webp&s=f4eb98877382658edbc5f182e3f522126ce6c5c3

Once again, our brains might identify that there are only two paths between the highlighted squares, and we can easily spot which one is the shortest: 

https://preview.redd.it/j8b1n009nr3b1.png?width=1555&format=png&auto=webp&s=2b62fe71c2b3091ed3735d24b3d9cbf575d29002

The path shown on the left takes 9 steps while the one on the right takes 11 steps.

But, who defined what a path is in this problem? Who defined which tiles we can move to when standing on a specific tile?

Our brains (or at least mine) intuitively assumed that the possible moves from a given position were the following:

https://preview.redd.it/v7qf7k0bnr3b1.png?width=256&format=png&auto=webp&s=204d5817b885b926f020b7479fdc84fef4cc64e5

So, as long as we are not trying to go to a “wall” tile, we can move to the left, right, up, or down.

Let’s take this set of movements and the “floor“ tiles and see how they relate to graphs. Assuming that the start and end tiles are also floor tiles, we can number every floor tile arbitrarily like this:

https://preview.redd.it/jwkf1lohnr3b1.png?width=649&format=png&auto=webp&s=c1e17e2971c1c99f9a658111f0a9646be0a27ade

We have 14 “floor” tiles, which can be represented as 14 nodes of a graph. So, what about the edges?

Let’s add an edge between two pairs of nodes if it exists a valid movement between their corresponding tiles on the map. For example, we can add edges between nodes 1 and 2, and also between nodes 13 and 14.

That being said, our problem can be reduced to finding the path with the minimum length between two nodes in an undirected graph.

This is the graph that results from taking every floor tile as a node and adding edges according to the valid moves that we defined:

https://preview.redd.it/u94iiezjnr3b1.png?width=2195&format=png&auto=webp&s=33388b27b52c9b19d444a51fd51b264f9248d7fa

The problem of finding a path with the minimum length between two nodes is a standard problem in the graph theory domain, and we will learn how to solve it in future posts of this series.

For the moment, let’s go back to our initial problem and try to model it using graphs applying what we learned from this example.

## Counting the Rooms

Let’s recall the problem we saw at the beginning of this post:

https://preview.redd.it/q63774ymnr3b1.png?width=1304&format=png&auto=webp&s=924e910b5767e9b60a7746efb2a798491bb6c585

Let’s number every floor tile, and assume that we have the same possible moves that we described above. That is, from a given tile we can move to the tiles at its right, left, top, and bottom as long as they are not “wall“ tiles.

A possible numbering could be the following:

https://preview.redd.it/bgtr6e0pnr3b1.png?width=649&format=png&auto=webp&s=3d451e28cf81d8ec82a07fcf60ea7ac9bd4fcfda

 Translating this map to a graph the same way we did before, we get the following: 

https://preview.redd.it/bz9ymsjqnr3b1.png?width=806&format=png&auto=webp&s=0311f27afc7d52f5a7f3cfde5c5a36d250c30b2c

And if we were to solve the problem of counting the number of rooms in a graph, we could rephrase that as counting the number of its [connected components](https://albexl.substack.com/p/introduction-to-graph-theory).

See all the “rooms“ taken to the domain of connected components below:

https://preview.redd.it/2xc3ctrtnr3b1.png?width=1742&format=png&auto=webp&s=305209b6f203bc9cf9921b2e15698aa1e05c736c

As you also might suspect, the problem of finding the connected components in an undirected graph is also a standard problem that can be solved by using various graph algorithms.

We will be covering those algorithms and more in future editions of Algorithmically Speaking.

In the meantime, it’s time to try what you’ve learned!

## Test Your Skills

I have seen a variety of challenges and puzzles on boards that I would like to share some of them with you today.

I would suggest that you try to focus first on solving them by any means possible and then try to think about how to model this problem using a bit of graph theory.

As I [promised before](https://albexl.substack.com/p/one-month-of-algorithmic-posts), no more plain-text statements. Here we go:

**Problem #1:**

https://preview.redd.it/xgj16v8znr3b1.png?width=1533&format=png&auto=webp&s=0e2c4b2ada71956c934bff787cdc79f71f0f93a3

 **Problem #2:**

https://preview.redd.it/za6no143or3b1.png?width=1304&format=png&auto=webp&s=ed8e954472dbe4201880e15f851e254ded26fc87

## Conclusions

I hope I was able to keep igniting your passion for graph theory by showing you some basic guidelines on how to model board problems using graphs.

This approach is used in numerous real-life applications (at the top of my mind I can think of numerous examples related to the gaming industry).

Also, I recently stumbled upon this [video](https://www.youtube.com/watch?v=ZMQbHMgK2rw&t=795s) where I found out about a competition that has been going on for more than 50 years and has a lot to do with boards, mazes, and of course, graphs.

Some takeaways:

* Board problems can usually be modeled as graphs by taking some set of tiles as the nodes and the possible moves between the tiles as the edges.
* Usually, board games involve tasks such as counting regions, or finding paths which are usually standard problems of the graph theory domain.
* The chessboard is a [bipartite graph](https://albexl.substack.com/p/an-introduction-to-graphs-ii). Do you see it now?

I wish you good luck when solving this week’s challenges. Don’t forget to share your progress with the community!

If you think this post can be helpful for someone, share it with them. Nothing will make me happier!

See you next week!",albeXL,35,1.0,0,https://www.reddit.com/r/computerscience/comments/13z6n1u/exploring_how_to_model_board_games_as_graph/
42,1685863546.0,What's best way to store scientific text to support CRUD.,I am trying to store text that can scientific notations and mathematical symbols. Wanted to discuss what's best way to store it so that it can be retrieved and rendered in webpage and can be edited also if needed. Currently thinking MarkDown + Latex for math symbols.,oldSeaBird,0,0.29,1,https://www.reddit.com/r/computerscience/comments/1404x71/whats_best_way_to_store_scientific_text_to/
43,1685810018.0,Theoretical Approaches to crack large files encrypted with AES,"I have a large file (> 200 Gb), that I encrypted a while ago with AES-256-CBC. The file itself is a tar which I ran through openssl. I've forgotten the exact password, but have a general idea of what it is.

Brute force is the easiest way to crack this from what I've seen (given the circumstances that I have a general theory of what the passwords might be), but the hitch I've run into is the time its taking me to actually try each combination. I have a script running on a server, which seems to be taking it ~ 15 minutes before spitting out that its wrong.

I can't help but think there has to be a better way to solve this.",HeadClicker52,5,0.78,5,https://www.reddit.com/r/computerscience/comments/13zhzsf/theoretical_approaches_to_crack_large_files/
44,1685808682.0,[Article] Average Case Lower Bounds For Comparision-Based Sorting Algorithms,,luciferreeves,0,0.5,1,https://thatcomputerscientist.com/weblog/sorting-averagecase-lower-bounds
45,1685709636.0,Algorithmically Speaking - #6: Graphs and Boards,"Hello there!

After three weeks of learning the basics of graphs, I think it is time to show you examples of how we can translate real-life problems to the graph theory domain 

This will be the last of a series of posts introducing the basic concepts of graph theory before we dive into topics such as traversals, and finding cycles, among others.

Today, we will learn about practical examples of how to use graphs in real life. For that, we are going to see examples of “games” that are played on boards. They might seem unrelated to graphs, but the truth is that they are more closely related than you might think.

Read the full article here: [Algorithmically Speaking - #6: Graphs and Boards](https://albexl.substack.com/p/graphs-and-boards)

Don't forget to share your thoughts on the comments below. Have a wonderful day!",albeXL,24,1.0,0,https://www.reddit.com/r/computerscience/comments/13ybn07/algorithmically_speaking_6_graphs_and_boards/
46,1685735341.0,What kind of data structure to efficiently cache a time series?,"The issue I'm having with a hash table is that if you cache the series from June to July and then request June to August, the hash of the date intervals are different and so you incur a cache miss on the second operation. So you end up fetching the data from June to July twice since the second interval is a subset of the first.",plutoniator,0,0.5,1,https://www.reddit.com/r/computerscience/comments/13ymxqw/what_kind_of_data_structure_to_efficiently_cache/
47,1685564787.0,I created an Advanced AI Basketball Referee,,_ayushp_,691,0.97,25,https://v.redd.it/hf1u06x8p93b1
48,1685694795.0,Why binary digits are grouped in 4 bits?,"Edit:- one more question 
Were the binary numbers represented in grouping of 4 bits from the starting or we are grouping them in 4 only after the introduction of hexadecimal( to make conversion between them more easy)",Spirited-Escape7923,0,0.42,6,https://www.reddit.com/r/computerscience/comments/13y6zfx/why_binary_digits_are_grouped_in_4_bits/
49,1685658855.0,The proof that O(2^n) < O(n²) doesn't quite makes sense to me,"Plotting the two functions clearly show the growth difference between the two, but I wanted to prove that O(n²) < O(2\^n) mathematically.

I've found [this explanation](https://stackoverflow.com/a/34688328) on SO, and by doing the L'Hopitals rule with both functions, I obtain: 

https://preview.redd.it/p6yfmchugh3b1.png?width=85&format=png&auto=webp&s=e30a2aeeefd3ee78d3ad01c36789ecb6c97451a0

It may be because I'm a little bit rusty on my calc, but what does this actually mean? Why is this the proof that O(n²) < O(2\^n)?",theBadRoboT84,2,0.56,7,https://www.reddit.com/r/computerscience/comments/13xvjgp/the_proof_that_o2n_on²_doesnt_quite_makes_sense/
50,1685640992.0,A Manifesto for Cloud-Oriented Programming from the creator of the CDK,"In this [insightful article](https://docs.winglang.io/blog/2022/11/23/manifesto), Elad Ben-Israel, the mind behind the CDK, shares his love for the cloud, but also his frustrations with the complexity of building cloud applications. The challenges he identifies include:
1. Focus on non-functional mechanics: The need to understand and manage cloud platform mechanics instead of focusing on building valuable features for users.
2. Lack of independence: Developers often need to rely on others to handle parts of the deployment process or to resolve issues, interrupting their work flow.
3. Delayed feedback: The current iteration cycle in cloud development can take minutes or even longer, significantly slowing down the development process and making it harder for developers to stay in their flow state.

## It's not just a rant
Elad is not just ranting about cloud development. He proposes a solution in the form of a programming language for the cloud. This language would treat the entire cloud as its computer. The language compiler will be able to see the complete cloud application, unbound by the limits of individual machines. Such a compiler would be able to handle a significant portion of the application's non-functional aspects, enabling developers to operate at a more abstract level, thus reducing complexity and promoting autonomy. Moreover, it could expedite iteration cycles by allowing to compile applications to quick local simulators during the development process. 

## The Winglang Project
Elad reveals that he's in the process of developing such an open-source, “cloud-oriented” language, dubbed [Winglang](https://github.com/winglang/wing). Wing aims to improve the developer experience of cloud applications by enabling developers to build distributed systems that leverage cloud services as first-class citizens. This is achieved by integrating infrastructure and application code in a secure, unified programming model. Wing programs can be executed locally via a fully-functional simulator or deployed to any cloud provider.

## My Interest in Winglang
I, together with a group of dedicated contributors, joined forces with Elad to develop Winglang.
While still in Alpha and not yet ready for production use, it's already possible to build some [real applications](https://github.com/winglang/research/tree/main/dogfooding).

Check out https://github.com/winglang/wing for more details.",shai-ber,0,0.33,0,https://www.reddit.com/r/computerscience/comments/13xny90/a_manifesto_for_cloudoriented_programming_from/
51,1685618802.0,Resources on parallel programming,"I would like to learn how to design parallel algorithms in depth. I've taken a course covering OpenMP and MPI, but I would like to know more.

Especially I'm interested in designing some common parallel - eg. sorting algorithms such as quicksort and mergesort, etc.

I've looked at the GNU implementations of these algorithms and would like to know if there are any resources explaining those?

I don't really mind the format of these resources - books, articles, papers, videos, idc.",TuruMan,0,0.14,0,https://www.reddit.com/r/computerscience/comments/13xf0t0/resources_on_parallel_programming/
52,1685604245.0,what can I study in 20 days?,"My exams are in 3 weeks. So I have 20 days at my disposal.

What I have already learnt:

1. Python language
2. Data Structures and algorithms (125 questions so far)
3. Nand2tetris part 1

What I think I can't learn due to limited time:

1. Nand2tetris part 2
2. OS
3. Networking
4. Dynamic programming

Is there anything I *can* learn in limited time that is valuable af?",AwaysGays,0,0.33,3,https://www.reddit.com/r/computerscience/comments/13xazu2/what_can_i_study_in_20_days/
53,1685502120.0,What are some good networks to test nmap on?,Are there common ones people use for testing?  Or does anyone know any specific ip’s that will return some good data to get a feel for how nmap performs?,PoliteRuleFollower,26,0.96,3,https://www.reddit.com/r/computerscience/comments/13wagac/what_are_some_good_networks_to_test_nmap_on/
54,1685557044.0,Need help (newbie) - Church-encoded Booleans,"Hi everyone,

I don't know where to ask, so I come to this place. I know that we're not to ask questions regarding programming issues in this subreddit, but I didn't find any programming subreddit (including lisp, scheme and the like) that felt appropriate because I'm stuck at the theoretical, mathematical, logical level.

I'm taking CS classes at Uni, but it's a non-standard ""lateral"" track, so we're to study a lot of stuff on our own. I'm currently trying to get a grasp on the lambda calculus because I feel it is helpful for functional programming.

I'm at a loss when it comes to understanding Church booleans.

(I know ""normal"" booleans from programming languages like Java, were you set x (or boolean x) = true or ask whether x == 5 or 4 == 7 which might evualuate to true or false).

So, my ""hang-up"":

Church convention:

true ≡ λa.λb. a

false ≡ λa.λb. b

If you use beta reduction, true gives you back whatever you use and discards λb.

λa.λb. a (5)

\----> 5

but

λa.λb. b (5)

\----> 5

...that is the same and \_almost\_ like the identity function. This, I don't understand.

But my bigger problem, which, of course, probably arises from not properly understanding Church booleans in the first place, is if-then.

if ≡ λp.λa.λb. p a b

How do I go from here to ""choosing λa if true and λb if false""?

My first try was obviously BS because I used the bound variables of λa and λb for λp, which was not so smart.

\[This was my try for ""True"":

    λp.λa.λb. p a b                      (TRUE) a b
    λp.λa.λb. p a b                      (λa.λb. a) a b
    λa.λb. ( (λa.λb. a) a b)              a b
    λa.λb.  ((λb. a)  b)                  a b

eeerm...what?....oops.

... yeah, didn't make sense. I don't think I can use a and b when it comes to p because they are already lambda-bound?)

&#x200B;

How does p --> TRUE ""trigger"" an output of λa and p --> FALSE λb?

&#x200B;

Thank you so much in advance!

&#x200B;

&#x200B;

edit because of typos",chocolatesuperfood,1,1.0,8,https://www.reddit.com/r/computerscience/comments/13wtpy9/need_help_newbie_churchencoded_booleans/
55,1685556017.0,Are there any deep-dives anywhere into CPU Architecture?,"Here's an image I just stumbled across while reading about DOOM.  It shows the architecture and separate areas of transistors that do certain functions.  What I'm looking for is more info on how the transistors are layed out, what each transistor is doing, and how each section is used.  I understand that they are logic-gates, but I don't understand why there are so many of them and how they're used in code.

https://preview.redd.it/tpy39vcsy83b1.png?width=654&format=png&auto=webp&s=bc6b4fe419f13289da6a681a6a83046c9746c7fc",,0,0.5,6,https://www.reddit.com/r/computerscience/comments/13wtafp/are_there_any_deepdives_anywhere_into_cpu/
56,1685582654.0,why is refresh rate measured in hertz,"let me know if this is the right sub for this question or not. i'm just curious, and google won't really give me a straight answer. hertz measures things that oscillate right? don't lcd monitors just display the whole frame at once? is it a holdover from old cathode ray monitors that drew from top to bottom?",fabulog,0,0.33,2,https://www.reddit.com/r/computerscience/comments/13x4et3/why_is_refresh_rate_measured_in_hertz/
57,1685462302.0,🧠 Cognitive Load Developer's Handbook,,RobinCrusoe25,31,0.94,0,https://github.com/zakirullin/cognitive-load
58,1685402078.0,A Introduction to Concurrent B+ Trees,https://medium.com/@mkrebser/concurrent-b-trees-concurrentsorteddictionary-c-net-f7c1c2a84141,monte_carino,14,0.95,1,https://www.reddit.com/r/computerscience/comments/13v9nz0/a_introduction_to_concurrent_b_trees/
59,1685381895.0,Interesting CS research paper recommendation.," I love reading CS research papers and would love to get a recommendation from you guys. It could be from any field of CS, but please don't recommend any that is too old and not relevant anymore.

Thanks",mrcarrot213,25,0.84,4,https://www.reddit.com/r/computerscience/comments/13v1bes/interesting_cs_research_paper_recommendation/
60,1685396763.0,Labyrinth puzzles modeled as graph theory problems,"This Friday I plan to share a post explaining how to model games or puzzles on rectangular boards using graph theory.

To prepare my audience for that, I created this problem set to give you a hint of the topics that will be covered in the post:

[Puzzles - #1: Labyrinths](https://albexl.substack.com/p/puzzles-1-labyrinths)

Try them out and let me know how it goes. Stay tuned for the article on Friday published on [Algorithmically Speaking](https://albexl.substack.com/).

Have a wonderful day!",albeXL,10,0.86,4,https://www.reddit.com/r/computerscience/comments/13v7kbg/labyrinth_puzzles_modeled_as_graph_theory_problems/
